{
  "meta": {
    "id": "deadlock-test",
    "name": "Deadlock Test",
    "version": 1,
    "color_count": 2,
    "notes": "Solvable under correct play (pick the two red buckets at [0,5] and [0,6]); reaches rules-doc deadlock under bad play. Bad sequence: pick [0,0] through [0,4] — buffer fills with 5 blue buckets but field has only red slices, so no consumption occurs and the buffer cannot free a slot. With no remaining legal actions (buffer full), the episode terminates as a deadlock-lose. The random agent hits deadlock on seeds where it picks enough blues before reds."
  },
  "field": {
    "stacks": [
      { "col": 0, "row": 0, "slices": ["red", "red", "red", "red"] }
    ]
  },
  "buffer": { "slots": 5, "bucket_capacity": 2 },
  "reserve": {
    "rows": 1,
    "cols": 7,
    "cells": [
      { "row": 0, "col": 0, "type": "plain_bucket", "color": "blue" },
      { "row": 0, "col": 1, "type": "plain_bucket", "color": "blue" },
      { "row": 0, "col": 2, "type": "plain_bucket", "color": "blue" },
      { "row": 0, "col": 3, "type": "plain_bucket", "color": "blue" },
      { "row": 0, "col": 4, "type": "plain_bucket", "color": "blue" },
      { "row": 0, "col": 5, "type": "plain_bucket", "color": "red" },
      { "row": 0, "col": 6, "type": "plain_bucket", "color": "red" }
    ]
  }
}
